{
  "schemaVersion": 1,
  "id": "home-device-hubitat-temperature-default",
  "name": "Hubitat temperature sensor Home card",
  "deviceTypeId": "sensor",
  "integrationKind": "hubitat",
  "externalDeviceType": "temperature",
  "style": {
    "columnSpan": 1,
    "rowSpan": 1,
    "shape": "rounded",
    "cornerRadius": 10,
    "showIcon": true,
    "showName": true,
    "showType": false,
    "showState": true,
    "fontSize": 13,
    "iconSize": 22,
    "stateIconSize": 13,
    "stateLabelFontSize": 10,
    "stateValueFontSize": 12
  },
  "presentation": {
    "pinnedProperties": ["temperature", "humidity", "battery"],
    "pinnedCommands": [],
    "pinnedSliders": []
  }
}
