{"schemaVersion":1,"id":"home-device-hubitat-tuya-temperature-humidity-illuminance-lcd-display-with-a-clock-default","name":"Hubitat Tuya temperature humidity illuminance LCD display with a clock","deviceTypeId":"integration-child","integrationKind":"hubitat","externalDeviceType":"Tuya Temperature Humidity Illuminance LCD Display with a Clock","style":{"columnSpan":1,"rowSpan":2,"height":1.5,"shape":"rounded","cornerRadius":10,"fontSize":14,"iconSize":22,"stateIconSize":17,"stateLabelFontSize":17,"stateValueFontSize":17,"stateButtonFontSize":10,"showIcon":true,"showName":true,"showType":false,"showState":false},"presentation":{"pinnedProperties":["temperature","humidity","battery","switch","level","motion","contact","presence","lock","illuminance","thermostatMode","heatingSetpoint","coolingSetpoint"],"pinnedCommands":["power"],"pinnedSliders":["level"]}}